{
  "result_schema_version": 1,
  "doppel_version": "0.7.1",
  "generated_at": "2026-08-27T14:56:52.712073+00:00",
  "dataset": {
    "name": "doppel.memory-quality.zh.v1",
    "version": 1,
    "language": "zh-CN",
    "fingerprint": "999b9f51bfa9c2bfe55935a0b8eec334f5017559a31e822246b6e41af3c9d2bc",
    "case_count": 10,
    "message_count": 34,
    "query_count": 11,
    "gold_memory_count": 13,
    "ignored_message_count": 17,
    "recent_window_size": 5
  },
  "environment": {
    "python": "3.12.13",
    "implementation": "CPython",
    "platform": "Windows-11-10.0.26200-SP0"
  },
  "measured_dimensions": [
    "evidence_recall",
    "candidate_precision",
    "reciprocal_rank",
    "abstention",
    "forbidden_evidence",
    "scope_isolation",
    "redundancy",
    "context_characters",
    "retrieval_latency"
  ],
  "not_yet_measured": [
    "memory_extraction",
    "memory_consolidation",
    "conflict_resolution",
    "answer_correctness",
    "llm_token_cost"
  ],
  "baselines": [
    {
      "name": "no_memory",
      "version": "1",
      "capabilities": {
        "extracts_memories": false,
        "consolidates_memories": false,
        "generates_answers": false
      },
      "aggregate": {
        "query_count": 11,
        "required_query_count": 10,
        "abstention_query_count": 1,
        "macro_evidence_recall": 0.0,
        "macro_candidate_precision": 0.0909,
        "mean_reciprocal_rank": 0.0,
        "abstention_accuracy": 1.0,
        "forbidden_candidate_hits": 0,
        "scope_leakage_count": 0,
        "redundant_relevant_candidates": 0,
        "average_candidates": 0.0,
        "average_context_characters": 0.0,
        "prepare_latency_ms": {
          "total": 0.0,
          "p50": 0.0,
          "p95": 0.0
        },
        "query_latency_ms": {
          "p50": 0.0,
          "p95": 0.0,
          "max": 0.0
        }
      },
      "cases": [
        {
          "name": "stable-preference-behind-noise",
          "category": "stable_fact",
          "queries": [
            {
              "name": "q-preference-cilantro",
              "query": "我对香菜是什么态度？",
              "authorized_scopes": [
                "owner-chat-a",
                "owner-user"
              ],
              "required_group_count": 1,
              "covered_group_count": 0,
              "retrieved_count": 0,
              "relevant_candidate_count": 0,
              "evidence_recall": 0.0,
              "candidate_precision": 0.0,
              "reciprocal_rank": 0.0,
              "abstention_passed": false,
              "forbidden_candidate_hits": 0,
              "scope_leakage_count": 0,
              "redundant_relevant_candidates": 0,
              "context_characters": 0,
              "latency_ms": 0.0,
              "candidates": []
            }
          ]
        },
        {
          "name": "explicit-preference-correction",
          "category": "correction",
          "queries": [
            {
              "name": "q-current-favorite-color",
              "query": "我现在最喜欢什么颜色？",
              "authorized_scopes": [
                "owner-chat-a",
                "owner-user"
              ],
              "required_group_count": 1,
              "covered_group_count": 0,
              "retrieved_count": 0,
              "relevant_candidate_count": 0,
              "evidence_recall": 0.0,
              "candidate_precision": 0.0,
              "reciprocal_rank": 0.0,
              "abstention_passed": false,
              "forbidden_candidate_hits": 0,
              "scope_leakage_count": 0,
              "redundant_relevant_candidates": 0,
              "context_characters": 0,
              "latency_ms": 0.0,
              "candidates": []
            }
          ]
        },
        {
          "name": "speaker-attribution-allergy",
          "category": "role_attribution",
          "queries": [
            {
              "name": "q-owner-peanut-allergy",
              "query": "我自己有花生过敏吗？",
              "authorized_scopes": [
                "owner-chat-a",
                "owner-user"
              ],
              "required_group_count": 1,
              "covered_group_count": 0,
              "retrieved_count": 0,
              "relevant_candidate_count": 0,
              "evidence_recall": 0.0,
              "candidate_precision": 0.0,
              "reciprocal_rank": 0.0,
              "abstention_passed": false,
              "forbidden_candidate_hits": 0,
              "scope_leakage_count": 0,
              "redundant_relevant_candidates": 0,
              "context_characters": 0,
              "latency_ms": 0.0,
              "candidates": []
            },
            {
              "name": "q-contact-peanut-allergy",
              "query": "联系人有什么食物过敏？",
              "authorized_scopes": [
                "owner-chat-a"
              ],
              "required_group_count": 1,
              "covered_group_count": 0,
              "retrieved_count": 0,
              "relevant_candidate_count": 0,
              "evidence_recall": 0.0,
              "candidate_precision": 0.0,
              "reciprocal_rank": 0.0,
              "abstention_passed": false,
              "forbidden_candidate_hits": 0,
              "scope_leakage_count": 0,
              "redundant_relevant_candidates": 0,
              "context_characters": 0,
              "latency_ms": 0.0,
              "candidates": []
            }
          ]
        },
        {
          "name": "agent-suggestion-is-not-user-fact",
          "category": "authority",
          "queries": [
            {
              "name": "q-owner-vegetarian",
              "query": "我是素食主义者吗？",
              "authorized_scopes": [
                "owner-chat-a",
                "owner-user"
              ],
              "required_group_count": 1,
              "covered_group_count": 0,
              "retrieved_count": 0,
              "relevant_candidate_count": 0,
              "evidence_recall": 0.0,
              "candidate_precision": 0.0,
              "reciprocal_rank": 0.0,
              "abstention_passed": false,
              "forbidden_candidate_hits": 0,
              "scope_leakage_count": 0,
              "redundant_relevant_candidates": 0,
              "context_characters": 0,
              "latency_ms": 0.0,
              "candidates": []
            }
          ]
        },
        {
          "name": "cross-user-scope-adversary",
          "category": "scope_isolation",
          "queries": [
            {
              "name": "q-owner-cat-name",
              "query": "我的猫叫什么名字？",
              "authorized_scopes": [
                "owner-chat-a",
                "owner-user"
              ],
              "required_group_count": 1,
              "covered_group_count": 0,
              "retrieved_count": 0,
              "relevant_candidate_count": 0,
              "evidence_recall": 0.0,
              "candidate_precision": 0.0,
              "reciprocal_rank": 0.0,
              "abstention_passed": false,
              "forbidden_candidate_hits": 0,
              "scope_leakage_count": 0,
              "redundant_relevant_candidates": 0,
              "context_characters": 0,
              "latency_ms": 0.0,
              "candidates": []
            }
          ]
        },
        {
          "name": "explicit-cross-conversation-user-memory",
          "category": "scope_hierarchy",
          "queries": [
            {
              "name": "q-owner-current-work",
              "query": "我目前在哪里做什么工作？",
              "authorized_scopes": [
                "owner-chat-b",
                "owner-user"
              ],
              "required_group_count": 1,
              "covered_group_count": 0,
              "retrieved_count": 0,
              "relevant_candidate_count": 0,
              "evidence_recall": 0.0,
              "candidate_precision": 0.0,
              "reciprocal_rank": 0.0,
              "abstention_passed": false,
              "forbidden_candidate_hits": 0,
              "scope_leakage_count": 0,
              "redundant_relevant_candidates": 0,
              "context_characters": 0,
              "latency_ms": 0.0,
              "candidates": []
            }
          ]
        },
        {
          "name": "paraphrase-after-long-distractors",
          "category": "long_horizon",
          "queries": [
            {
              "name": "q-weekend-outdoor-activity",
              "query": "我周末通常做什么户外活动？",
              "authorized_scopes": [
                "owner-chat-a",
                "owner-user"
              ],
              "required_group_count": 1,
              "covered_group_count": 0,
              "retrieved_count": 0,
              "relevant_candidate_count": 0,
              "evidence_recall": 0.0,
              "candidate_precision": 0.0,
              "reciprocal_rank": 0.0,
              "abstention_passed": false,
              "forbidden_candidate_hits": 0,
              "scope_leakage_count": 0,
              "redundant_relevant_candidates": 0,
              "context_characters": 0,
              "latency_ms": 0.0,
              "candidates": []
            }
          ]
        },
        {
          "name": "current-residence-correction",
          "category": "stale_fact",
          "queries": [
            {
              "name": "q-current-residence",
              "query": "我现在住在哪个城市？",
              "authorized_scopes": [
                "owner-chat-a",
                "owner-user"
              ],
              "required_group_count": 1,
              "covered_group_count": 0,
              "retrieved_count": 0,
              "relevant_candidate_count": 0,
              "evidence_recall": 0.0,
              "candidate_precision": 0.0,
              "reciprocal_rank": 0.0,
              "abstention_passed": false,
              "forbidden_candidate_hits": 0,
              "scope_leakage_count": 0,